1109,Community Academy PCS,Cluster 21,"Edgewood, Bloomingdale, Truxton Circle, Eckington",Community Academy -  Amos III,"1400 1st St NW Washington, DC",20001,Cluster 21,Community Academy PCS - Amos III,21,"1400 1st St., NW, Washington, DC 20001",140000,900,488,0.542222222,38.908694,-77.012158,1109,200,0.28,0.47,0.23,0.02,201,0.23880597,0.462686567,0.288557214,0.009950249,,1109,COMMUNITY ACADEMY PCS - ELEMENTARY  (AMOS III),266,62,71,54,51,28,33,37,30,50,41,31,,,,,,,,15,23,10,6,5,Community Academy Amos III Amstrong,479,58,66,60,45,43,33,37,25,29,44,39,,,,,,,10,19,21,9,4,"Community Academy Public Charter School, Inc.",PCS,,2013,1109,27472410.94,1444400,,,28916810.94,15893,748614,764507,29681317.94,1109,COMMUNITY ACADEMY AMOS III AMSTRONG,All Grades,All Students,174,49,81,39,5,0.252873563,2,174,44,84,42,4,0.264367816,2.0344827591110,D.C. Preparatory Academy PCS,Cluster 32,"River Terrace, Benning, Greenway, Dupont Park",D.C. Preparatory Academy - Benning Academy Campus,"100 41st St NE Washington, DC",20019,Cluster 32,DC Prep: Benning Campus,32,"100 41st St., NE, Washington, DC 20019",70090,720,332,0.461111111,38.89099,-76.944558,,,,,,,,,,,,,1110,DC PREP  BENNING ELEMENTARY,332,71,67,64,62,68,,,,,,,,,,,,,7,3,8,2,,5,DC  Preparatory Benning Campus PCS,431,76,74,66,71,70,74,,,,,,,,,,,,6,5,14,4,1,,PCS,,,,,,,,,,,,,1110,D C  PREPARATORY BENNING CAMPUS PCS,All Grades,All Students,71,1,28,36,6,0.591549296,2.661971831,71,5,27,37,2,0.549295775,2.5070422541112,Early Childhood Academy PCS,Cluster 39,"Congress Heights, Bellevue, Washington Highlands",Early Childhood Academy (Walter Washington Campus),"4301 9th Street, SE Washington, DC",20032,Cluster 39,Early Childhood Academy PCS - Walter Washington Campus,39,"4301 9th St. SE, Washington, DC 20032",12000,250,248,0.992,38.831505,-76.989835,1112,31,0.193548387,0.483870968,0.258064516,0.064516129,31,0.258064516,0.419354839,0.322580645,0,,1112,EARLY CHILDHOOD ACADEMY,248,39,68,46,31,37,27,,,,,,,,,,,,,13,8,,,8,Early Childhood Academy PCS-Washington,113,26,47,,,,40,,,,,,,,,,,,,7,3,,,"Early Childhood Academy Public Charter School, Inc.",PCS,,2013,1112,3668392.428,155000,,,3823392.428,50000,284561,334561,4157953.428,1112,EARLY CHILDHOOD ACADEMY PCS WALTER WASHINGTON,All Grades,All Students,39,3,19,14,3,0.435897436,2.435897436,39,3,15,21,0,0.538461538,2.4615384621113,Excel Academy PCS,Cluster 37,"Sheridan, Barry Farm, Buena Vista",Excel Academy,"2501 Martin Luther King Ave SE Washington, DC",20020,Cluster 37,Excel Academy PCS,37,"2501 M. L. King, Jr., Ave., SE, Washington, DC 20020",59000,550,401,0.729090909,38.86145,-76.99384,1113,43,0.11627907,0.255813953,0.488372093,0.139534884,43,0.093023256,0.372093023,0.441860465,0.093023256,,1113,EXCEL ACADEMY,401,71,86,73,69,58,44,,,,,,,,,,,,,6,6,,,8,Excel Academy PCS,515,81,95,90,79,73,54,43,,,,,,,,,,,,8,11,2,1,Excel Academy Public Charter School,PCS,,2013,1113,7319564.001,601714,,,7921278.001,185000,110628,295628,8216906.001,1113,EXCEL ACADEMY PCS,All Grades,All Students,92,6,32,46,8,0.586956522,2.608695652,92,15,35,40,2,0.456521739,2.3152173911114,Howard Road Academy PCS,Cluster 34,"Twining, Fairlawn, Randle Highlands, Penn Branch, Fort Davis Park, Fort Dupont",Howard Road Academy - Penn Ave,"3000 Pennsylvania Ave SE Washington, DC",20020,Cluster 34,Howard Road Academy PCS - Penn Ave,34,"3000 Pennsylvania Ave,. SE, Washington, DC 20020",5600,163,154,0.944785276,38.871072,-76.964689,,,,,,,,,,,,,1114,HOWARD ROAD ACADEMY PENN,154,61,41,34,18,,,,,,,,,,,,,,,,1,,1,8,Howard Road Academy PCS- PA Ave,151,52,65,34,,,,,,,,,,,,,,,,2,,,1,,PCS,,,,,,,,,,,,,,,,,,,,,,,,,,,,,,1116,Imagine Southeast PCS,Cluster 39,"Congress Heights, Bellevue, Washington Highlands",Imagine Southeast PCS,"3100 Martin Luther King Ave SE Washington, DC",20032,Cluster 39,Imagine Southeast PCS,39,"3100 Martin Luther King Jr. Ave., SE, Washington, DC ",50000,608,553,0.909539474,38.843884,-76.998566,1116,158,0.183544304,0.487341772,0.284810127,0.044303797,158,0.221518987,0.411392405,0.348101266,0.018987342,,1116,IMAGINE SOUTHEAST,553,52,105,99,85,46,42,44,38,42,,,,,,,,,,17,19,4,6,8,Imagine Southeast PCS,611,54,57,105,96,85,49,35,46,43,41,,,,,,,,,33,21,2,4,Imagine Southeast Public Charter School,PCS,,2013,1116,9196916.69,0,,,9196916.69,,,0,9196916.69,1116,IMAGINE SOUTHEAST PCS,All Grades,All Students,207,58,82,60,7,0.323671498,2.077294686,207,51,103,48,5,0.256038647,2.0338164251117,Washington Yu Ying PCS,Cluster 20,"North Michigan Park, Michigan Park, University Heights",Washington Yu Ying  PCS,"220 Taylor St., NE, Washington, DC ",20017,Cluster 20,Washington Yu Ying PCS,20,"220 Taylor St., NE, Washington, DC ",40000,500,367,0.734,38.940739,-77.003102,1117,72,0.069444444,0.305555556,0.444444444,0.180555556,72,0.055555556,0.222222222,0.652777778,0.069444444,,1117,WASHINGTON YU YING,367,,111,64,63,55,43,31,,,,,,,,,,,29,15,1,10,,5,Washington Yu Ying PCS,439,,76,114,68,64,53,41,23,,,,,,,,,,28,19,2,10,,Washington Yu Ying Public Charter School,PCS,,2013,1117,6786878.289,0,,,6786878.289,,,0,6786878.289,1117,WASHINGTON YU YING PCS,All Grades,All Students,117,3,19,58,37,0.811965812,3.102564103,117,2,33,69,13,0.700854701,2.7948717951118,Washington Latin PCS,Cluster 18,"Brightwood Park, Crestwood, Petworth",Washington Latin High PCS,"4715 16th St Nw Washington, DC",20011,Cluster 18,Washington Latin PCS: Upper School Campus (Upshur),18,"4715 16th St., NW, Washington, DC 20011",13730,250,225,0.9,38.947431,-77.036371,1118,59,0.101694915,0.271186441,0.542372881,0.084745763,60,0.1,0.3,0.466666667,0.133333333,,1118,WASHINGTON LATIN HIGH,225,,,,,,,,,,,,74,61,48,42,,,5,9,3,,,4,Washington Latin PCS HS,244,,,,,,,,,,,,80,63,54,47,,,4,9,7,,1,Washington Latin Public Charter School,PCS,,2013,1118,8387573.813,155000,,,8542573.813,300000,182700,482700,9025273.813,1118,WASHINGTON LATIN PCS HS,All Grades,All Students,61,2,17,33,9,0.68852459,2.803278689,61,2,12,36,11,0.770491803,2.9180327871119,Carlos Rosario PCS,Cluster 2,"Columbia Heights, Mt. Pleasant, Pleasant Plains, Park View",Carlos Rosario International,"1100 Harvard St NW Washington, DC",20009,Cluster 2,Carlos Rosario International PCS,2,"1100 Harvard St., NW, Washington, DC 20009",78990,2389,1808,0.756802009,38.926731,-77.027282,,,,,,,,,,,,,1119,CARLOS ROSARIO,1808,,,,,,,,,,,,,,,,1808,,86,,,,,1,Carlos Rosario International PCS ,1941,,,,,,,,,,,,,,,,1941,,101,,,,,Carlos Rosario International Public Charter School,PCS,,2013,1119,18636384.77,505500,,,19141884.77,,451000,451000,19592884.77,,,,,,,,,,,,,,,,,,1120,National Collegiate Academy PCS,Cluster 39,"Congress Heights, Bellevue, Washington Highlands",National Collegiate Preparatory,"908 Wahler  Place SE Washington, DC",20032,Cluster 39,National Collegiate Preparatory PCS,39,"908 Wahler Pl., SE, Washington, DC 20032",27000,309,203,0.656957929,38.83394,-76.99237,1120,62,0.064516129,0.532258065,0.387096774,0.016129032,62,0.096774194,0.370967742,0.532258065,0,,1120,NATIONAL COLLEGIATE PREPARATORY,203,,,,,,,,,,,,85,72,46,,,,3,13,13,3,4,8,National Collegiate Prep PCS,310,,,,,,,,,,,,91,86,77,56,,,,21,26,5,1,National Collegiate Preparatory Public Charter High School,PCS,,2013,1120,5137131.981,403699.6185,,,5540831.6,0,0,0,5540831.6,1120,NATIONAL COLLEGIATE PREP PCS,All Grades,All Students,69,23,33,13,0,0.188405797,1.855072464,69,6,41,21,1,0.31884058,2.2463768121121,KIPP Academy PCS,Cluster 33,"Capitol View, Marshall Heights, Benning Heights",KIPP DC - Promise Academy,"4801 Benning Road SE Washington, DC",20019,Cluster 33,,,,,,,,,,1121,102,0.058823529,0.656862745,0.274509804,0.009803922,102,0.107843137,0.37254902,0.509803922,0.009803922,,1121,KIPP DC PROMISE ACADEMY,311,,,,103,104,104,,,,,,,,,,,,,21,10,1,2,7,KIPP DC Promise PCS,415,,,,108,104,99,104,,,,,,,,,,,,25,20,1,1,,PCS,,,,,,,,,,,,,1121,KIPP DC PROMISE PCS,All Grades,All Students,202,10,65,104,23,0.628712871,2.693069307,202,15,73,99,15,0.564356436,2.5643564361122,KIPP Academy PCS,Cluster 37,"Sheridan, Barry Farm, Buena Vista",KIPP DC - Discover Academy,"2600 Douglass Road SE Washington, DC",20020,Cluster 37,,,,,,,,,,,,,,,,,,,,,,1122,KIPP DC DISCOVER ACADEMY,303,98,105,100,,,,,,,,,,,,,,,,11,1,,1,8,KIPP DC Discover PCS,305,98,104,103,,,,,,,,,,,,,,,,13,5,,1,,PCS,,,,,,,,,,,,,,,,,,,,,,,,,,,,,,1123,KIPP Academy PCS,Cluster 37,"Sheridan, Barry Farm, Buena Vista",KIPP DC - College Preparatory,"2600 Douglass Road SE Washington, DC",20020,Cluster 37,,,,,,,,,,1123,95,0.031578947,0.210526316,0.631578947,0.126315789,95,0.021052632,0.463157895,0.442105263,0.073684211,,1123,KIPP DC COLLEGE PREPARATORY,330,,,,,,,,,,,,135,108,87,,,,,16,26,7,1,8,KIPP DC College Prep PCS,399,,,,,,,,,,,,134,109,74,82,,,,8,21,28,3,,PCS,,,,,,,,,,,,,1123,KIPP DC COLLEGE PREP PCS,All Grades,All Students,102,2,11,62,27,0.87254902,3.117647059,102,6,27,59,10,0.676470588,2.7156862751124,Friendship PCS,Cluster 39,"Congress Heights, Bellevue, Washington Highlands",Friendship - Tech Prep,"620 Milwaukee Place SE Washington, DC",20032,Cluster 39,Friendship PCS- Technology Preparatory Academy,39,"620 Milwaukee Pl., SE, Washington, DC 20032",21482,477,378,0.79245283,38.848058,-76.997017,1124,313,0.108626198,0.383386581,0.412140575,0.095846645,314,0.124203822,0.535031847,0.28343949,0.057324841,,1124,FRIENDSHIP TECH PREP,378,,,,,,,,,117,113,106,42,,,,,,,14,46,6,2,8,Friendship PCS Tech Prep,369,,,,,,,,,72,92,83,89,33,,,,,,11,51,16,3,,PCS,,,,,,,,,,,,,1124,FRIENDSHIP PCS TECH PREP,All Grades,All Students,264,32,105,115,12,0.481060606,2.40530303,266,28,142,85,11,0.360902256,2.2969924811125,Eagle Academy PCS,Cluster 27,"Near Southeast, Navy Yard",Eagle Academy - New Jersey Ave Campus,"1017 New Jersey SE Washington, DC",20003,Cluster 27,Eagle Academy PCS- New Jersey Avenue,27,"1017 New Jersey Avenue, SE 20003",12000,126,160,1.26984127,38.87817,-77.004771,1125,37,0.513513514,0.243243243,0.189189189,0.054054054,37,0.27027027,0.351351351,0.378378378,0,,1125,EAGLE ACADEMY NEW JERSEY,160,,,,47,73,40,,,,,,,,,,,,,6,27,2,8,6,Eagle Academy PCS NJ Avenue Campus,125,53,30,27,15,,,,,,,,,,,,,,,2,1,,1,"Eagle Academy Public Charter School, Inc.",PCS,,2013,1125,12780470.82,558600,,,13339070.82,0,1274741,1274741,14613811.82,,,,,,,,,,,,,,,,,,1126,Howard Road Academy PCS,Cluster 37,"Sheridan, Barry Farm, Buena Vista",Howard Road Academy - Martin Luther King Ave,"2450 Martin Luther King Ave SE Washington, DC",20059,Cluster 37,Howard Road Academy Middle PCS - MLK Ave,37,"2450 M. L. King Jr. Ave., SE, Washington, DC 20020",4500,120,129,1.075,38.862253,-76.99313,1126,120,0.108333333,0.375,0.475,0.041666667,120,0.075,0.533333333,0.341666667,0.05,,1126,HOWARD ROAD ACADEMY MLK,129,,,,,,,,,,76,53,,,,,,,,4,10,1,,8,Howard Road Academy PCS MLK,114,,,,,,,,,,63,51,,,,,,,,5,8,3,1,,PCS,,,,,,,,,,,,,1126,HOWARD ROAD ACADEMY PCS  MLK CAMPUS,All Grades,All Students,106,8,29,60,9,0.650943396,2.660377358,106,6,44,46,10,0.528301887,2.5660377361129,KIPP Academy PCS,Cluster 7,"Shaw, Logan Circle",KIPP DC - Grow Academy,"421 P St NW Washington, DC",20001,Cluster 7,KIPP DC GROW Academy PCS,7,"421 P Street, NW, Washington DC",100000,1000,531,0.531,38.909651,-77.016996,,,,,,,,,,,,,1129,KIPP DC GROW ACADEMY,203,,102,101,,,,,,,,,,,,,,,,11,3,,1,2,KIPP DC GROW Academy PCS,308,104,101,103,,,,,,,,,,,,,,,9,17,3,1,,,PCS,,,,,,,,,,,,,,,,,,,,,,,,,,,,,,1137,Apple Tree Early Learning PCS,Cluster 25,"Union Station, Stanton Park, Kingman Park",AppleTree Early Learning - Oklahoma Ave,"330 21st Street, NE Washington, DC",20002,Cluster 25,AppleTree  Early Learning PCS - Oklahoma Ave.,25,"330 21st Street, NE 20002",15866,160,158,0.9875,38.89367,-76.975113,,,,,,,,,,,,,1137,APPLETREE EARLY LEARNING OKLAHOMA,158,79,79,,,,,,,,,,,,,,,,,2,,,,7,AppleTree PCS Oklahoma,162,95,67,,,,,,,,,,,,,,,,3,2,,,,,PCS,,,,,,,,,,,,,,,,,,,,,,,,,,,,,,1138,E.L. Haynes PCS,Cluster 18,"Brightwood Park, Crestwood, Petworth",E.L Haynes - Kansas Ave Campus,"4501 Kansas Ave NW Washington, DC",20010,Cluster 18,E.L. Haynes PCS - Kansas Avenue,18,"4501 Kansas Avenue, NW 20011",83000,557,403,0.723518851,38.945241,-77.023391,,,,,,,,,,,,,1138,EL HAYNES PCS KANSAS AVE HIGH SCHOOL,403,39,45,47,75,76,,,,,,,121,,,,,,95,29,17,2,3,4,E L  Haynes PCS Kansas Avenue Campus,554,36,47,46,49,74,75,,,,,,127,100,,,,,136,36,34,5,15,,PCS,,,,,,,,,,,,,1138,E L  HAYNES PCS KANSAS AVENUE CAMPUS,All Grades,All Students,168,24,59,65,20,0.505952381,2.482142857,168,25,45,74,24,0.583333333,2.5773809523064,Inspired Teaching Demonstration PCS,Cluster 20,"North Michigan Park, Michigan Park, University Heights",Inspired Teaching Demonstration,"1328 Florida Avenue, NW Washington, DC",20009,Cluster 20,Inspired Teaching Demonstration PCS,20,"1328 Florida Avenue, NW 20009",0,550,142,0.258181818,38.920356,-77.030398,3064,13,0.230769231,0.538461538,0.230769231,0,13,0.230769231,0.307692308,0.461538462,0,,3064,INSPIRED TEACHING DEMONSTRATION,142,45,22,18,24,18,15,,,,,,,,,,,,,9,1,,,1,Inspired Teaching Demonstration PCS,207,44,44,43,20,19,23,14,,,,,,,,,,,,7,3,,2,Inspired Teaching Demonstration Public Charter School,PCS,,2013,3064,3022501.719,0,,,3022501.719,,,0,3022501.719,3064,INSPIRED TEACHING DEMONSTRATION PCS,All Grades,All Students,37,4,9,20,4,0.648648649,2.648648649,37,1,15,17,4,0.567567568,2.6486486493065,Mundo Verde Bilingual PCS,Cluster 6,"Dupont Circle, Connecticut Avenue/K Street",Mundo Verde Bilingual PCS,"3220 16th St. NW, Washington, DC",20010,Cluster 6,Mundo Verde PCS,6,"3220 16th St. NW, Washington, DC",22330,270,122,0.451851852,38.930881,-77.03645,,,,,,,,,,,,,3065,MUNDO VERDE,122,38,38,46,,,,,,,,,,,,,,,39,5,,,,1,Mundo Verde Bilingual PCS,237,40,64,69,64,,,,,,,,,,,,,,64,18,,,,Mundo Verde Public Charter School,PCS,,2013,3065,4123515.078,380802,,,4504317.078,50000,370493,420493,4924810.078,,,,,,,,,,,,,,,,,,3066,Shining Stars Montessori Academy PCS,Cluster 2,"Columbia Heights, Mt. Pleasant, Pleasant Plains, Park View",Shining Stars Montessori,"1328 Florida Av. NW, Washington, DC",20009,Cluster 2,Shining Stars Montessori Academy PCS,2,"1328 Florida Av. NW, Washington, DC",7554,120,53,0.441666667,38.920356,-77.030398,,,,,,,,,,,,,3066,SHINING STAR MONTESSORI,53,33,11,9,,,,,,,,,,,,,,,10,1,,1,,1,Shining Stars Montessori PCS,55,25,15,7,8,,,,,,,,,,,,,,6,2,,,1,Shining Stars Montessori Academy Public Charter School,PCS,,2013,3066,898752.925,229578,,,1128330.925,26961,0,26961,1155291.925,,,,,,,,,,,,,,,,,,3067,Richard Wright PCS for Journalism and Media Arts PCS,Cluster 27,"North Michigan Park, Michigan Park, University Heights",Richard Wright PCS for Journalism and Media Arts,"770 M St SE, Washington, DC",20003,Cluster 20,Richard Wright PCS,20,"100 41st Street, NE, Washington, DC",28000,202,125,0.618811881,38.89099,-76.944558,3067,30,0.166666667,0.5,0.3,0.033333333,30,0.166666667,0.6,0.166666667,0.066666667,,3067,RICHARD WRIGHT,125,,,,,,,,,,,34,91,,,,,,2,7,18,5,2,6,Richard Wright PCS,202,,,,,,,,,,,33,83,86,,,,,1,14,15,4,4,Richard Wright PCS for Journalism and Media Arts,PCS,,2013,3067,3425540.043,591071,,,4016611.043,10000,2214,12214,4028825.043,3067,RICHARD WRIGHT PCS FOR JOURNALISM AND MEDIA ARTS,All Grades,All Students,112,29,55,28,0,0.25,1.991071429,113,6,57,49,1,0.442477876,2.3982300883072,Apple Tree Early Learning PCS,Cluster 38,"Douglas, Shipley Terrace",AppleTree Early Learning - Douglass Knoll,"2017 Savannah Terrace SE Washington, DC",20020,Cluster 38,AppleTree Early Learning PCS - Douglas Knoll,38,"2017 Savannah Terrace, SE 20020",9677,160,86,0.5375,38.847857,-76.976402,3072,-,-,-,-,-,-,-,-,-,-,,3072,APPLETREE EARLY LEARNING DOUGLASS KNOLL,80,53,27,,,,,,,,,,,,,,,,1,1,,,,8,AppleTree PCS Douglass Knoll,86,44,42,,,,,,,,,,,,,,,,,3,,,,,PCS,,,,,,,,,,,,,,,,,,,,,,,,,,,,,,3073,Apple Tree Early Learning PCS,Cluster 38,"Douglas, Shipley Terrace",AppleTree Early Learning - Lincoln,"138 12th Street, NE Washington, DC",20019,Cluster 38,AppleTree  Early Learning PCS - Lincoln Park,26,"138 12th Street, NE  20019",8975,160,60,0.375,38.891294,-76.990243,3073,48,0.25,0.458333333,0.25,0.041666667,48,0.1875,0.479166667,0.3125,0.020833333,,3073,APPLETREE EARLY LEARNING LINCOLN,60,45,15,,,,,,,,,,,,,,,,4,1,,,,6,AppleTree PCS Lincoln,61,35,26,,,,,,,,,,,,,,,,1,1,1,,,,PCS,,,,,,,,,,,,,,,,,,,,,,,,,,,,,,3074,Apple Tree Early Learning PCS,Cluster 38,"Douglas, Shipley Terrace",AppleTree Early Learning - Parkland,"2011 Savannah Street, SE Washington, DC",20020,Cluster 38,AppleTree  Early Learning PCS -Parkland,38,"2011 Savannah Street, SE 20020",7484,160,80,0.5,38.84665,-76.975437,3074,444,0.689189189,0.245495495,0.045045045,0.02027027,455,0.608791209,0.296703297,0.07032967,0.024175824,,3074,APPLETREE EARLY LEARNING PARKLAND,80,56,24,,,,,,,,,,,,,,,,1,1,,,1,8,AppleTree PCS Parkland,86,42,44,,,,,,,,,,,,,,,,,,2,,,,PCS,,,,,,,,,,,,,,,,,,,,,,,,,,,,,,A1,BASIS DC PCS,Cluster 8,"Downtown, Chinatown, Penn Quarters, Mount Vernon Square, North Capitol Street",BASIS DC PCS,412 8th Street NW,20004,Cluster 8,BASIS DC PCS,8,"412 8th Street, NW 20004",42000,511,445,0.870841487,38.895063,-77.022963,A1,107,0.009345794,0.299065421,0.523364486,0.168224299,107,0.028037383,0.280373832,0.560747664,0.130841121,,A1,,,,,,,,,,,,,,,,,,,,,,,,,2,Basis DC PCS,443,,,,,,,,156,155,83,49,,,,,,,7,16,6,1,,BASIS Public Charter School,PCS,,2013,#N/A,6230792.501,255000,,,6485792.501,200000,5000,205000,6690792.501,,,,,,,,,,,,,,,,,,A2,Creative Minds PCS,Cluster 2,"Columbia Heights, Mt. Pleasant, Pleasant Plains, Park View",Creative Minds PCS,3324 16th Street NW,20010,Cluster 2,Creative Minds PCS,2,"3324 16th Street, NW 20010, Washington, DC",17808,105,105,1,38.932346,-77.036463,A2,114,0.210526316,0.394736842,0.289473684,0.105263158,114,0.149122807,0.385964912,0.429824561,0.035087719,,A2,,,,,,,,,,,,,,,,,,,,,,,,,1,Creative Minds PCS,105,33,32,16,12,12,,,,,,,,,,,,,6,15,3,1,4,Creative Minds Public Charter School,PCS,,2013,#N/A,2052102.321,0,,,2052102.321,,,0,2052102.321,,,,,,,,,,,,,,,,,,A3,DC Scholars PCS,Cluster 18,"Brightwood Park, Crestwood, Petworth",DC Scholars,5601 E Capitol Street SE,20011,Cluster 18,DC Scholars,18,"5601 E Capitol Street, SE 20011",19500,200,183,0.915,38.889702,-76.920562,A3,,,,,,,,,,,,A3,,,,,,,,,,,,,,,,,,,,,,,,,7,DC Scholars PCS,183,51,39,38,19,20,16,,,,,,,,,,,,,9,3,,1,DC Scholars PCS ,PCS,,2013,#N/A,2735450.396,0,,,2735450.396,,,0,2735450.396,,,,,,,,,,,,,,,,,,A5,LAYC Career Academy PCS,Cluster 2,"Columbia Heights, Mt. Pleasant, Pleasant Plains, Park View",LAYC Career Academy PCS,"3047 15th Street, NW 20009",20009,Cluster 2,LAYC Career Academy PCS,2,"3047 15th Street, NW 20009, Washington, DC",15500,125,121,0.968,38.927856,-77.03583,A5,,,,,,,,,,,,A5,,,,,,,,,,,,,,,,,,,,,,,,,1,LAYC Career Academy,103,,,,,,,,,,,,,4,13,21,65,,9,1,,,1,Career Academy Public Charter School,PCS,,2013,#N/A,1669409.151,0,,,1669409.151,,,0,1669409.151,,,,,,,,,,,,,,,,,,A4,KIPP Academy PCS,Cluster 2,"Shaw, Logan Circle",KIPP DC LEAD Academy,"421 P St NW Washington, DC, 20001",20001,Cluster 2,KIPP DC LEAD Academy,2,"421 P St NW Washington, DC, 20001",,,,,,,A4,,,,,,,,,,,,A4,,,,,,,,,,,,,,,,,,,,,,,,,2,KIPP DC LEAD Academy,107,,,,107,,,,,,,,,,,,,,3,6,3,,,,PCS,,,,,,,,,,,,,,,,,,,,,,,,,,,,,,