2011-12,,,,,,,,,,,,,,,,,,,,,,,,,,,,,,,,,,,,,,,,,,,,,,,,,,,,,,2012-13,,,,,,,,,,,,,,,,,,,,,,,,,,,,,,,,,,,,,,,,,,,,,,,,,,,,,,,,School Code,LEA Name,Cluster,NBH_NAMES,SchoolName,StreetAddr,ZIP_code,MAR_cluster,School  Name,Neighborhood Cluster,Address,GSF,Capacity,Enrollment SY11-12,Utilization,Lat,Long,School ID,1112Math Tested,1112Math BelowBasic,1112Math Basic,1112Math Proficient,1112Math Advanced,1112Reading Tested,1112Reading BelowBasic,1112Reading Basic,1112Reading Proficient,1112Reading Advanced,2011 Adjusted Cohort Grad Rate,OSSE Code,Name,Total Enrolled 2012,PK3,PK4,KG,1,2,3,4,5,6,7,8,9,10,11,12,AO,UN,ELL,Level 1,Level 2,Level 3,Level 4,Ward,Name,Total Enrolled 2012,PK3,PK4,KG,1,2,3,4,5,6,7,8,9,10,11,12,AO,UN,ELL,Level 1,Level 2,Level 3,Level 4,Name of School,PCS or DCPS,Bubdgt Org 4,Year,School No,DC Funding Allocation,Federal Revenue,INTRADISTRICT FUNDS,SPECIAL PURPOSE REVENUE FUNDS,Total Government Revenue,Donations,Fees and Other,Other Revenue,Total Revenue,School Code,School Name,Grade,Subgroup,MValid Tests (n),MBelow Basic (n),MBasic (n),MProficient (n),MAdvanced (n),MPercent Proficient (% Proficient & Advanced),MWeighted,RValid Tests (n),RBelow Basic (n),RBasic (n),RProficient (n),RAdvanced (n),RPercent Proficient (% Proficient & Advanced),RWeighted101,Maya Angelou PCS,Cluster 33,"Capitol View, Marshall Heights, Benning Heights",Maya Angelou PCS - Evans Upper,"5600 East Capitol St NE Washington, DC",20019,Cluster 33,Maya Angelou PCS: Evans High School,33,"5600 East Capitol St., NE, Washington, DC 20019",37333,200,296,1.48,38.889828,-76.921256,101,70,0.285714286,0.528571429,0.185714286,0,69,0.188405797,0.710144928,0.101449275,0,0.65,101,MAYA ANGELOU EVANS UPPER,296,,,,,,,,,,,,,,,,,296,,5,14,61,4,7,Maya Angelou Evans Campus PCS,298,,,,,,,,,,,,78,75,86,59,,,,7,20,52,9,,PCS,,,,,,,,,,,,,0101,MAYA ANGELOU EVANS CAMPUS PCS,All Grades,All Students,55,16,32,7,0,0.127272727,1.836363636,55,10,33,11,1,0.218181818,2.054545455102A,Cesar Chavez Public PCS,Cluster 30,"Mayfair, Hillbrook, Mahaning Heights",Cesar Chavez PCS - Parkside MS,"3701 Hayes St NE Washington, DC",20019,Cluster 30,Cesar Chavez PCS: Parkside MS,30,"3701 Hayes St., NE, Washington, DC 20019",66860,1100,674,0.612727273,38.902095,-76.949053,102,109,0.04587156,0.440366972,0.486238532,0.027522936,109,0.073394495,0.458715596,0.412844037,0.055045872,,102,Cesar Chavez PCS - Parkside MS,298,,,,,,,,,94,99,105,,,,,,,,,,,,7,Cesar Chavez PCS - Parkside MS,320,,,,,,,,,117,106,95,1,1,,,,,2,6,35,12,1,,PCS,,,,,,,,,,,,,0102,CESAR CHAVEZ PARKSIDE MS PCS,All Grades,All Students,294,33,113,117,31,0.503401361,2.496598639,294,46,128,113,7,0.408163265,2.275510204102B,Cesar Chavez Public PCS,Cluster 30,"Mayfair, Hillbrook, Mahaning Heights",Cesar Chavez PCS - Parkside HS,"3702 Hayes St NE Washington, DC",20019,Cluster 31,Cesar Chavez PCS: Parkside HS,30,"3702 Hayes St., NE, Washington, DC 20019",,,,,,,102,268,0.097014925,0.328358209,0.485074627,0.089552239,268,0.138059701,0.451492537,0.391791045,0.018656716,0.8246,102,Cesar Chavez PCS - Parkside HS,376,,,,,,,,,,,,126,114,90,46,,,10,14,56,14,2,7,Cesar Chavez PCS - Parkside HS,389,,,,,,,,,,,,137,85,94,73,,,7,8,25,15,,,PCS,,,,,,,,,,,,,,,,,,,,,,,,,,,,,,103,William E. Doar Jr PCS,Cluster 21,"Edgewood, Bloomingdale, Truxton Circle, Eckington",William E. Doar Jr. - Northeast Elementary and Middle,"705 Edgewood Street NE Washington, DC",20017,Cluster 21,William E. Doar Junior PCS: NE Campus,21,"705 Edgewood St., NE, Washington, DC 20017",45000,560,426,0.760714286,38.924177,-76.995901,103,154,0.214285714,0.435064935,0.285714286,0.064935065,154,0.136363636,0.363636364,0.435064935,0.064935065,0.4211,103,WILLIAM E DOAR JR,259,26,25,24,28,24,27,14,24,27,22,18,,,,,,,,5,13,5,,5,William E. Doar Jr PCS,422,51,49,61,47,46,40,30,26,26,21,25,,,,,,,2,14,8,4,2,"William E. Doar, Jr. Public Charter School for the Performing Arts, Inc.",PCS,,2013,103,6517002.928,879704,,,7396706.928,10000,69142,79142,7475848.928,,,,,,,,,,,,,,,,,,105,Community Academy PCS,Cluster 18,"Brightwood Park, Crestwood, Petworth",Community Academy PCS - Amos I,"1300 Allison St NW Washington, DC",20011,Cluster 18,Community Academy PCS - Amos I,18,"1300 Allison St., NW, Washington, DC 20011",50000,519,461,0.888246628,38.945042,-77.02995,105,128,0.1171875,0.3671875,0.359375,0.15625,127,0.11023622,0.393700787,0.472440945,0.023622047,,105,COMMUNITY ACADEMY PCS (AMOS I),461,65,62,66,73,62,49,41,43,,,,,,,,,,,16,16,13,6,4,Community Academy Amos I,510,71,82,64,84,76,49,46,38,,,,,,,,,,204,13,26,9,5,,PCS,,,,,,,,,,,,,0105,COMMUNITY ACADEMY AMOS I,All Grades,All Students,129,18,50,50,11,0.472868217,2.418604651,129,15,53,57,4,0.472868217,2.387596899106,Community Academy PCS,Cluster 7,"Downtown, Chinatown, Penn Quarters, Mount Vernon Square, North Capitol Street",Community Academy - Butler Bilingual,"5 Thomas Circle NW Washington, DC",20005,Cluster 7,Community Academy PCS - Butler Bilingual,7,"5 Thomas Circle, NW, Washington, DC 20005",30000,300,303,1.01,38.905968,-77.032162,106,68,0.058823529,0.308823529,0.470588235,0.161764706,68,0.058823529,0.352941176,0.485294118,0.102941176,,106,COMMUNITY ACADEMY PCS BUTLER CAMPUS,303,50,64,56,41,23,31,19,19,,,,,,,,,,,10,2,5,2,1,Community Academy Butler Bilingual,308,52,66,52,44,35,17,25,17,,,,,,,,,,92,18,6,1,,,PCS,,,,,,,,,,,,,0106,COMMUNITY ACADEMY BUTLER BILINGUAL,All Grades,All Students,57,1,12,32,12,0.771929825,2.964912281,57,4,13,37,3,0.701754386,2.684210526108,Community Academy PCS,N/A,"Downtown, Chinatown, Penn Quarters, Mount Vernon Square, North Capitol Street",Community Academy - Online,"1351 Nicholson St NW Washington, DC",20011,N/A,Community Academy PCS - Online,N/A,"1351 Nicholson St., NW, Washington, DC 20011",0,195,111,0.569230769,38.960226,-77.031721,108,62,0.112903226,0.274193548,0.403225806,0.209677419,62,0.112903226,0.225806452,0.516129032,0.14516129,,108,COMMUNITY ACADEMY ONLINE,111,,,11,13,10,9,14,9,17,16,12,,,,,,,,7,1,,,4,Community Academy Online,120,,,12,14,18,15,9,16,10,12,14,,,,,,,,16,1,,1,,PCS,,,,,,,,,,,,,0108,COMMUNITY ACADEMY ONLINE,All Grades,All Students,69,5,22,33,9,0.608695652,2.666666667,68,4,17,40,7,0.691176471,2.735294118113,Friendship PCS,Cluster 39,"Congress Heights, Bellevue, Washington Highlands",Friendship - Southeast Elementary,"645 Milwaukee Place SE Washington, DC",20032,Cluster 39,Friendship PCS - Southeast Elementary Academy,39,"645 Milwaukee Pl., SE, Washington, DC 20032",47000,553,547,0.98915009,38.848042,-76.996758,113,226,0.075221239,0.438053097,0.438053097,0.048672566,226,0.146017699,0.539823009,0.296460177,0.017699115,,113,FRIENDSHIP SOUTHEAST,547,34,72,66,74,69,76,73,83,,,,,,,,,,,19,24,5,1,8,Friendship PCS SouthEast Academy,551,51,56,81,69,69,74,78,73,,,,,,,,,,,16,18,14,1,,PCS,,,,,,,,,,,,,0113,FRIENDSHIP PCS SOUTHEAST ACADEMY,All Grades,All Students,217,20,86,97,14,0.511520737,2.483870968,217,30,85,96,6,0.470046083,2.359447005114,Hope Community Academy PCS,Cluster 21,"Edgewood, Bloomingdale, Truxton Circle, Eckington",Hope Community - Tolson Campus PCS,"2917 8th St NE Washington, DC",20017,Cluster 21,Hope Community PCS: Tolson Campus,21,"2917 8th St., NE, Washington, DC 20017",0,430,425,0.988372093,38.926605,-76.994937,114,174,0.120689655,0.373563218,0.41954023,0.086206897,174,0.149425287,0.402298851,0.408045977,0.040229885,,114,HOPE COMMUNITY TOLSON,425,59,57,49,41,38,36,40,39,21,23,22,,,,,,,,30,4,,9,5,Hope Community PCS Tolson Campus,432,56,65,55,50,40,38,30,26,31,21,20,,,,,,,1,24,5,1,10,"Hope Community Charter School, Inc.",PCS,,2013,114,12332221.39,0,,,12332221.39,0,45489,45489,12377710.39,0114,HOPE COMMUNITY PCS TOLSON CAMPUS,All Grades,All Students,159,20,53,71,15,0.540880503,2.509433962,159,16,64,72,7,0.496855346,2.440251572115,Howard University Middle School of Math and Science,Cluster 3,"Howard University, Le Droit Park, Cardozo/Shaw",Howard University Middle School of Math and Science,"405 Howard Place NW Washington, DC",20059,Cluster 3,Howard University Middle School PCS,3,"405 Howard Pl., NW, Washington, DC, 20059",39600,360,307,0.852777778,38.92246,-77.021079,115,266,0.018796992,0.191729323,0.631578947,0.157894737,267,0.014981273,0.254681648,0.595505618,0.134831461,,115,HOWARD UNIVERSITY MIDDLE SCHOOL OF MATH-SCIENCE,307,,,,,,,,,118,100,89,,,,,,,,7,6,,,1,Howard University Math & Science PCS,316,,,,,,,,,108,115,93,,,,,,,,8,5,1,,Howard University Public Charter Middle School of Mathematics and Science,PCS,,2013,115,4354506.304,235000,,,4589506.304,0,1570000,1570000,6159506.304,0115,HOWARD UNIVERSITY MIDDLE SCHOOL OF MATH AND SCIENCE PCS,All Grades,All Students,307,9,57,167,74,0.785016287,2.996742671,307,9,74,175,49,0.729641694,2.859934853116,KIPP Academy PCS,Cluster 37,"Sheridan, Barry Farm, Buena Vista",KIPP DC - Aim Academy,"2600 Douglass Rd SE Washington, DC",20020,Cluster 37,KIPP DC AIM PCS Academy PCS,37,"2600 DOUGLAS ROAD SE, Washington, DC",137000,1500,1069,0.712666667,38.857196,-76.987425,116,307,0.022801303,0.127035831,0.534201954,0.315960912,307,0.058631922,0.348534202,0.508143322,0.084690554,,116,KIPP DC AIM ACADEMY,330,,,,,,,,92,90,75,73,,,,,,,1,3,24,25,4,8,KIPP DC AIM PCS Academy PCS,330,,,,,,,,89,88,82,71,,,,,,,1,7,18,29,2,KIPP DC and Affiliates,PCS,,2013,116,49927458.54,7211060,,,57138518.54,5437510,581812,6019322,63157840.54,0116,KIPP DC AIM PCS ACADEMY PCS,All Grades,All Students,314,12,58,124,120,0.777070064,3.121019108,314,21,111,151,31,0.579617834,2.611464968117,Potomac Lighthouse PCS,Cluster 20,"North Michigan Park, Michigan Park, University Heights",Potomac Lighthouse PCS,"4401 8th Street NE Washington, DC",20017,Cluster 20,Potomac Lighthouse PCS,20,"4401 8th St., NE, Washington, DC 20017",21000,400,328,0.82,38.942729,-76.994626,117,111,0.135135135,0.351351351,0.342342342,0.171171171,111,0.135135135,0.36036036,0.477477477,0.027027027,,117,POTOMAC LIGHTHOUSE,328,45,47,42,47,24,27,41,33,22,,,,,,,,,,8,14,4,1,5,Potomac Lighthouse PCS,397,50,48,52,35,52,32,35,45,25,23,,,,,,,,,8,11,2,1,Potomac Lighthouse Public Charter School,PCS,,2013,117,5904389.109,539451.8312,,,6443840.94,3041,38047,41088,6484928.94,0117,POTOMAC LIGHTHOUSE PCS,All Grades,All Students,142,19,53,53,17,0.492957746,2.478873239,142,28,51,57,6,0.443661972,2.288732394121,KIPP Academy PCS,Cluster 7,"Shaw, Logan Circle",KIPP DC - Will Academy,"421 P St NW Washington, DC",20001,Cluster 7,,,,,,,,,,121,313,0.07028754,0.261980831,0.466453674,0.201277955,313,0.063897764,0.38658147,0.440894569,0.108626198,,121,KIPP DC WILL ACADEMY,328,,,,,,,,84,87,85,72,,,,,,,1,14,23,9,4,2,KIPP DC WILL Academy PCS,337,,,,,,,28,71,82,77,79,,,,,,,,15,29,10,4,,PCS,,,,,,,,,,,,,0121,KIPP DC WILL ACADEMY PCS,All Grades,All Students,322,8,62,133,119,0.782608696,3.127329193,321,15,107,169,30,0.619937695,2.666666667123,Septima Clark PCS,Cluster 39,"Congress Heights, Bellevue, Washington Highlands",Septima Clark PCS,"2501 Martin Luther King Jr. SE Washington, DC",20020,Cluster 37,Septima Clark PCS,37,"2501 M. L. King, Jr., Ave., SE, Washington, DC 20020",28000,250,227,0.908,38.86145,-76.99384,123,48,0.25,0.395833333,0.354166667,0,48,0.25,0.416666667,0.291666667,0.041666667,,123,SEPTIMA CLARK,227,41,42,43,28,24,17,17,15,,,,,,,,,,,11,7,1,,8,Septima Clark PCS,230,42,44,42,34,21,16,9,12,10,,,,,,,,,,10,7,4,3,Septima Clark Public Charter School,PCS,,2013,123,3570130.626,329166,,,3899296.626,361500,255760,617260,4516556.626,0123,SEPTIMA CLARK PCS,All Grades,All Students,46,8,25,12,1,0.282608696,2.130434783,46,10,23,12,1,0.282608696,2.086956522125,Washington Latin PCS,Cluster 18,"Brightwood Park, Crestwood, Petworth",Washington Latin Middle PCS,"4115 16th St Nw Washington, DC",20011,Cluster 18,Washington Latin PCS: Middle School Campus (Decatur),18,"4115 16th St., NW, Washington, DC 20011",13658,325,349,1.073846154,38.941005,-77.036391,125,340,0.032352941,0.197058824,0.458823529,0.311764706,340,0.011764706,0.182352941,0.479411765,0.326470588,,125,WASHINGTON LATIN PCS MIDDLE,349,,,,,,,,84,87,88,90,,,,,,,7,18,3,,,4,Washington Latin PCS MS,353,,,,,,,,84,88,90,91,,,,,,,5,16,3,4,,,PCS,,,,,,,,,,,,,0125,WASHINGTON LATIN PCS MS,All Grades,All Students,347,9,67,148,123,0.780979827,3.109510086,348,10,60,196,82,0.798850575,3.005747126126,Education Strengthens Families PCS,Cluster 1,"Kalorama Heights, Adams Morgan, Lanier Heights",Briya PCS / Education Strengthens Families,"2333 Ontario Rd NW Washington, DC",20009,Cluster 1,Education Strengthens Families (Esf) PCS,1,"2333 Ontario Rd., NW, Washington, DC 20009",9190,495,395,0.797979798,38.920976,-77.040072,,,,,,,,,,,,,126,EDUCATION STRENGTHENS FAMILIES,395,35,8,,,,,,,,,,,,,,352,,74,7,,,,1,Education Strengthens Families ESF PCS,436,32,10,,,,,,,,,,,,,,394,,50,5,,,,Education Strengthens Families Public Charter School ,PCS,,2013,126,5031803.772,66200,,,5098003.772,79824,55245,135069,5233072.772,,,,,,,,,,,,,,,,,,127,Cesar Chavez Public PCS,Cluster 2,"Columbia Heights, Mt. Pleasant, Pleasant Plains, Park View",Cesar Chavez PCS Bruce Prep Campus,"770 Kenyon St NW Washington, DC",20010,Cluster 2,Cesar Chavez PCS: Bruce Prep Campus,2,"770 Kenyon St., NW, Washington, DC 20009",36059,450,320,0.711111111,38.92999,-77.024226,127,236,0.046610169,0.224576271,0.508474576,0.220338983,234,0.08974359,0.435897436,0.418803419,0.055555556,,127,CESAR CHAVEZ PCS BRUCE PREP,320,,,,,,,,,94,89,88,49,,,,,,130,3,25,6,2,1,Cesar Chavez PCS Chavez Prep,318,,,,,,,,,96,87,73,62,,,,,,126,11,21,3,,,PCS,,,,,,,,,,,,,0127,CESAR CHAVEZ PCS CHAVEZ PREP,All Grades,All Students,246,5,49,134,58,0.780487805,2.995934959,245,13,102,113,17,0.530612245,2.546938776128,YouthBuild PCS,Cluster 2,"Columbia Heights, Mt. Pleasant, Pleasant Plains, Park View",Youth Build PCS (LAYC),"3014 14th St NW Washington, DC",20009,Cluster 2,YouthBuild LAYC PCS,2,"3014 14th Street, NW 20009",n/a,121,105,0.867768595,38.92777,-77.032551,,,,,,,,,,,,,128,LAYC YOUTH BUILD,105,,,,,,,,,,,,,,,,,105,2,1,,,1,1,Youth Build LAYC PCS,116,,,,,,,,,,,,,,,,,116,34,5,3,2,5,,PCS,,,,,,,,,,,,,,,,,,,,,,,,,,,,,,130,D.C. Preparatory Academy PCS,Cluster 21,"Edgewood, Bloomingdale, Truxton Circle, Eckington",D.C. Preparatory Academy - Edgewood Elementary Pcs,"707 Edgewood St NE Washington, DC",20017,Cluster 21,DC Prep: Edgewood Elementary Campus,21,"707 Edgewood St., NE, Washington, DC 20017",50000,426,410,0.962441315,38.92421,-76.99589,130,63,0.031746032,0.238095238,0.444444444,0.285714286,63,0.047619048,0.19047619,0.761904762,0,,130,DC PREP  EDGEWOOD ELEMENTARY,410,74,65,70,67,66,68,,,,,,,,,,,,26,8,6,2,,5,DC  Preparatory Edgewood Elementary  PCS,420,72,65,78,69,64,72,,,,,,,,,,,,6,17,11,1,1,,PCS,,,,,,,,,,,,,0130,D C  PREPARATORY EDGEWOOD ELEMENTARY CAMPUS PCS,All Grades,All Students,71,3,14,43,11,0.76056338,2.873239437,71,6,17,43,5,0.676056338,2.661971831131,Hope Community Academy PCS,Cluster 19,"Lamont Riggs, Queens Chapel, Fort Totten, Pleasant Hill",Hope Community PCS - Lamond,"6200 Kansas Ave NE Washington, DC",20011,Cluster 19,Hope Community PCS: Lamond Campus,19,"6200 Kansas Ave., NE, Washington, DC 20017",76000,399,407,1.020050125,38.965615,-77.008266,131,68,0.029411765,0.441176471,0.338235294,0.191176471,68,0.073529412,0.426470588,0.485294118,0.014705882,,131,HOPE COMMUNITY LAMOND,407,71,92,76,54,41,23,27,16,7,,,,,,,,,,8,13,5,2,4,Hope Community PCS Lamond Campus,392,70,73,78,55,45,32,16,15,8,,,,,,,,,13,11,14,4,2,,PCS,,,,,,,,,,,,,0131,HOPE COMMUNITY PCS LAMOND CAMPUS,All Grades,All Students,70,11,33,24,2,0.371428571,2.242857143,70,8,34,28,0,0.4,2.285714286132,KIPP Academy PCS,Cluster 33,"Capitol View, Marshall Heights, Benning Heights",KIPP DC - LEAP Academy,"4801 Benning Road SE Washington, DC",20019,Cluster 33,,,,,,,,,,,,,,,,,,,,,,132,KIPP DC LEAP PCS,304,102,100,102,,,,,,,,,,,,,,,,21,2,,,7,KIPP DC LEAP Academy PCS,302,100,101,101,,,,,,,,,,,,,,,2,16,4,,,,PCS,,,,,,,,,,,,,,,,,,,,,,,,,,,,,,133,Maya Angelou PCS,Cluster 33,"Capitol View, Marshall Heights, Benning Heights",Maya Angelou - Lower (Middle School Campus),"5600 East Capitol St NE Washington, DC",20019,Cluster 33,Maya Angelou PCS - Evans Middle,33,"5600 East Capitol St., NE, Washington, DC 20019",37333,700,210,0.3,38.889828,-76.921256,133,192,0.28125,0.4375,0.276041667,0.005208333,191,0.214659686,0.497382199,0.272251309,0.015706806,,133,MAYA ANGELOU EVANS LOWER,210,,,,,,,,,63,69,78,,,,,,,,2,5,41,7,7,Maya Angelou Middle Campus PCS,196,,,,,,,,,56,73,67,,,,,,,,10,11,25,9,Maya Angelou Public Charter School,PCS,,2013,133,11083570.99,674016,,,11757586.99,0,0,0,11757586.99,0133,MAYA ANGELOU MIDDLE CAMPUS PCS,All Grades,All Students,170,40,66,61,3,0.376470588,2.158823529,170,24,84,56,6,0.364705882,2.258823529134,Ideal Academy PCS,Cluster 19,"Lamont Riggs, Queens Chapel, Fort Totten, Pleasant Hill",Ideal Academy PCS - North Capitol Street Campus  ,"6130 North Capitol St NW Washington, DC",20011,Cluster 19,Ideal Academy PCS,19,"6130 North Capitol St., NW, Washington, DC 20011",32000,281,272,0.96797153,38.965277,-77.009084,134,117,0.153846154,0.47008547,0.341880342,0.034188034,117,0.162393162,0.401709402,0.41025641,0.025641026,0.6857,134,IDEAL ACADEMY,272,21,45,28,25,26,18,19,33,17,17,23,,,,,,,11,14,6,,,4,Ideal Academy PCS ,280,33,41,38,28,29,26,17,17,20,13,18,,,,,,,9,15,4,2,,Ideal Academy Public Charter School  (FY2011 data),PCS,,2013,134,5074455.366,938101,,,6012556.366,110000,18403,128403,6140959.366,0134,IDEAL ACADEMY PCS   NORTH CAPITOL STREET CAMPUS ES,All Grades,All Students,96,16,32,39,9,0.5,2.427083333,96,12,36,42,6,0.5,2.4375135,Mary McLeod Bethune  PCS,Cluster 22,"Brookland, Brentwood, Langdon",Mary McLeod Bethune PCS,"1404 Jackson St NE Washington, DC",20772,Cluster 22,Mary McLeod Bethune Day Academy PCS,22,"1404 Jackson St., NE, Washington, DC 20017",24243,368,327,0.888586957,38.929822,-76.985858,135,142,0.154929577,0.478873239,0.330985915,0.035211268,142,0.197183099,0.401408451,0.387323944,0.014084507,,135,MARY MCLEOD BETHUNE,327,44,35,37,30,30,32,32,33,21,19,14,,,,,,,,17,20,4,1,5,Mary McLeod Bethune Day Academy PCS ,366,36,57,42,30,41,30,37,28,32,17,16,,,,,,,15,9,26,9,1,Mary McLeod Bethune Day Academy Public Charter School,PCS,,2013,135,5556367.532,497892,,,6054259.532,0,7000,7000,6061259.532,0135,MARY MCLEOD BETHUNE DAY ACADEMY PCS SLOWE CAMPUS,All Grades,All Students,155,19,60,70,6,0.490322581,2.406451613,154,20,68,61,5,0.428571429,2.331168831138,Early Childhood Academy PCS,Cluster 39,"Congress Heights, Bellevue, Washington Highlands",Early Childhood Academy PCS (Johenning Campus),"4301 9th St SE Washington, DC",20032,Cluster 39,Early Childhood Academy PCS - Johenning Campus,39,"4301 9th St. SE, Washington, DC 20032",15600,250,135,0.54,38.831505,-76.989835,,,,,,,,,,,,,138,,,,,,,,,,,,,,,,,,,,,,,,,8,Early Childhood Academy PCS-Johenning,135,13,,44,42,36,,,,,,,,,,,,,,9,6,,,,PCS,,,,,,,,,,,,,,,,,,,,,,,,,,,,,,139,Apple Tree Early Learning PCS,Cluster 9,"Southwest Employment Area, Southwest/Waterfront, Fort McNair, Buzzard Point",AppleTree Early Learning - Amidon,"401 I St SW  Washington, DC",20024,Cluster 9,AppleTree Early Learning PCS - Amidon ,9,"401 I Street, SW 20024",2200,160,41,0.25625,38.879278,-77.01769,,,,,,,,,,,,,139,APPLETREE EARLY LEARNING AMIDON,41,41,,,,,,,,,,,,,,,,,7,1,1,,1,6,AppleTree PCS Amidon,44,44,,,,,,,,,,,,,,,,,4,,,,,Appletree Early Learning Public Charter School,PCS,,2013,139,10814503.38,384273,,,11198776.38,277800,440250,718050,11916826.38,,,,,,,,,,,,,,,,,,140,Apple Tree Early Learning PCS,Cluster 2,"Columbia Heights, Mt. Pleasant, Pleasant Plains, Park View",AppleTree Early Learning - Columbia Heights,"2750 14th Street, NW Washington, DC",20009,Cluster 2,AppleTree Early Learning PCS - Columbia Heights,2,"2750 14th Street, NW 20009",12204,160,158,0.9875,38.924845,-77.032224,,,,,,,,,,,,,140,APPLETREE EARLY LEARNING COLUMBIA HGHTS,158,106,52,,,,,,,,,,,,,,,,40,5,2,,1,1,AppleTree PCS Columbia Heights,161,100,61,,,,,,,,,,,,,,,,47,6,2,,2,,PCS,,,,,,,,,,,,,,,,,,,,,,,,,,,,,,141,Apple Tree Early Learning PCS,Cluster 8,"Downtown, Chinatown, Penn Quarters, Mount Vernon Square, North Capitol Street",AppleTree Early Learning - Riverside,"680 I Street, SW Washington, DC",20024,Cluster 9,AppleTree Early Learning PCS - Riverside ,9,"680 I Street, SW 20024",3600,160,40,0.25,38.879268,-77.02055,,,,,,,,,,,,,141,APPLETREE EARLY LEARNING RIVERSIDE,40,,40,,,,,,,,,,,,,,,,1,,,,1,6,AppleTree PCS Riverside,40,,40,,,,,,,,,,,,,,,,7,1,1,,1,,PCS,,,,,,,,,,,,,,,,,,,,,,,,,,,,,,142,Bridges PCS,Cluster 18,"Brightwood Park, Crestwood, Petworth",Bridges,"1250 Taylor St NW Washington, DC",20011,Cluster 18,Bridges PCS,18,"1250 Taylor Street NW, Washington, DC",9830,86,86,1,38.940787,-77.028243,,,,,,,,,,,,,142,BRIDGES,86,56,30,,,,,,,,,,,,,,,,34,5,4,1,11,4,Bridges PCS,143,67,49,27,,,,,,,,,,,,,,,66,13,6,,15,"Bridges Public Charter School, Inc.",PCS,,2013,142,3206756.355,94315,,,3301071.355,20000,87606,107606,3408677.355,,,,,,,,,,,,,,,,,,146,E.L. Haynes PCS,Cluster 2,"Columbia Heights, Mt. Pleasant, Pleasant Plains, Park View",E.L Haynes - Georgia Ave Campus,"3600 Georgia Ave NW Washington, DC",20010,Cluster 2,E.L. Haynes PCS - Georgia Avenue,2,"3600 Georgia Avenue, NW, Washington DC 20010",46000,398,394,0.989949749,38.934233,-77.023995,146,383,0.070496084,0.27154047,0.472584856,0.18537859,384,0.119791667,0.291666667,0.489583333,0.098958333,,146,EL HAYNES PCS  GEORGIA AVE CAMPUS,394,,,,,,50,52,53,91,97,51,,,,,,,67,21,30,16,9,1,E L  Haynes PCS Georgia Avenue,395,,,,,,,50,50,101,99,95,,,,,,,82,14,13,20,35,"Euphemia L. Haynes Public Charter School, Inc. and Subsidiaries",PCS,,2013,146,16889805.55,0,,,16889805.55,,,0,16889805.55,0146,E L  HAYNES PCS GEORGIA AVENUE,All Grades,All Students,376,31,103,171,71,0.643617021,2.75,370,27,119,183,41,0.605405405,2.643243243151,Booker T. Washington PCS,Cluster 3,"Howard University, Le Droit Park, Cardozo/Shaw",Booker T. Washington Evening,"1346 Florida Ave NW Washington, DC",20009,Cluster 3,Booker T. Washington PCS for the Technical Arts,3,"1346 Florida Ave., NW, Washington, DC 20009",35000,368,408,1.108695652,38.920293,-77.030718,151,38,0.473684211,0.315789474,0.210526316,0,38,0.184210526,0.5,0.263157895,0.052631579,0.8605,151,BOOKER T WASHINGTON EVENING,34,,,,,,,,,,,,64,49,49,54,1,,,8,21,6,5,1,Booker T  Washington PCS,362,,,,,,,,,,,,69,49,44,45,155,,13,10,20,11,6,"Booker T. Washington Public Charter School, Inc.",PCS,,2013,151,5433144.418,392000,,,5825144.418,20000,70000,90000,5915144.418,0151,BOOKER T  WASHINGTON PCS,All Grades,All Students,40,14,19,7,0,0.175,1.825,40,9,24,6,1,0.175,1.975153,Cesar Chavez Public PCS,Cluster 26,"Capitol Hill, Lincoln Park",Cesar Chavez - Capitol Hill PCS,"709 12th St SE Washington, DC",20003,Cluster 26,Cesar Chavez PCS: Capitol Hill Campus,26,"709 12th St., SE, Washington, DC 20003",40000,430,392,0.911627907,38.880982,-76.990244,153,125,0.08,0.36,0.52,0.04,125,0.096,0.504,0.368,0.032,0.8488,153,CESAR CHAVEZ PCS CAPITOL HILL,392,,,,,,,,,,,,148,133,60,51,,,9,10,31,11,9,6,Cesar Chavez Capitol Hill PCS,409,,,,,,,,,,,,154,105,72,78,,,14,7,27,10,13,Cesar Chavez Public Charter Schools for Public Policy,PCS,,2013,153,23168977.94,2491398,,,25660375.94,528440,228716,757156,26417531.94,0153,CESAR CHAVEZ CAPITOL HILL PCS,All Grades,All Students,101,10,49,42,0,0.415841584,2.316831683,101,10,43,42,6,0.475247525,2.435643564155,Friendship PCS,Cluster 26,"Capitol Hill, Lincoln Park",Friendship - Chamberlain,"1345 Potomac Ave SE Washington, DC",20002,Cluster 26,Friendship PCS - Chamberlain Elementary & Middle,26,"1345 Potomac Ave., SE, Washington, DC 20002",80660,758,765,1.009234828,38.879689,-76.987085,155,440,0.115909091,0.345454545,0.445454545,0.093181818,440,0.115909091,0.470454545,0.386363636,0.027272727,,155,FRIENDSHIP  CHAMBERLAIN,765,38,62,69,68,71,69,79,69,83,79,78,,,,,,,3,31,26,12,1,6,Friendship PCS Chamberlain,760,37,56,68,70,71,73,66,72,81,84,82,,,,,,,1,34,29,9,5,,PCS,,,,,,,,,,,,,0155,FRIENDSHIP PCS CHAMBERLAIN,All Grades,All Students,447,62,134,193,58,0.561521253,2.552572707,447,45,193,187,22,0.467561521,2.416107383156,Friendship PCS,Cluster 24,"Woodridge, Fort Lincoln, Gateway",Friendship - Woodridge,"2959 Carlton Ave NE Washington, DC",20018,Cluster 24,Friendship PCS - Woodridge Elementary & Middle,24,"2959 Carlton Ave., NE, Washington, DC 20018",67600,382,498,1.303664921,38.929406,-76.967322,156,274,0.153284672,0.357664234,0.434306569,0.054744526,274,0.153284672,0.332116788,0.47810219,0.03649635,,156,FRIENDSHIP WOODRIDGE,498,51,52,44,33,34,55,36,45,48,51,49,,,,,,,14,16,24,8,6,5,Friendship PCS Woodridge Campus,477,41,52,49,46,38,33,38,36,38,51,55,,,,,,,14,23,24,3,15,,PCS,,,,,,,,,,,,,0156,FRIENDSHIP PCS WOODRIDGE CAMPUS,All Grades,All Students,237,30,91,102,14,0.489451477,2.421940928,235,31,99,96,9,0.446808511,2.353191489157,Friendship PCS,Cluster 25,"Union Station, Stanton Park, Kingman Park",Friendship - Blow Pierce,"725 19th St NE Washington, DC",20002,Cluster 25,Friendship PCS - Blow-Pierce Elementary & Middle,25,"725 19th St., NE, Washington, DC 20002",62994,685,641,0.935766423,38.898247,-76.976634,157,330,0.13030303,0.390909091,0.439393939,0.039393939,329,0.182370821,0.495440729,0.313069909,0.009118541,,157,FRIENDSHIP BLOW PIERCE,641,67,88,65,40,27,17,34,42,87,84,90,,,,,,,2,20,34,15,10,7,Friendship PCS Blow Pierce,683,77,77,82,62,45,30,27,38,71,90,84,,,,,,,5,23,34,19,7,"Friendship Public Charter School, Inc. ",PCS,,2013,157,60982398.89,10851516,,,71833914.89,650839,1194989,1845828,73679742.89,0157,FRIENDSHIP PCS BLOW PIERCE,All Grades,All Students,324,54,124,131,15,0.450617284,2.330246914,324,68,157,93,6,0.305555556,2.114197531158,Community Academy PCS,Cluster 18,"Brightwood Park, Crestwood, Petworth",Community Academy - Amos II,"1351 Nicholson St NW Washington, DC",20011,Cluster 18,Community Academy PCS - Amos II,18,"1351 Nicholson St., NW, Washington, DC 20011",55000,285,137,0.480701754,38.960226,-77.031721,158,62,0.161290323,0.580645161,0.209677419,0.048387097,62,0.258064516,0.387096774,0.35483871,0,,158,COMMUNITY ACADEMY PCS (AMOS II),137,57,41,39,,,,,,,,,,,,,,,,4,1,,,5,Community Academy Amos II,280,100,108,72,,,,,,,,,,,,,,,116,8,1,,,,PCS,,,,,,,,,,,,,,,,,,,,,,,,,,,,,,